{
  "id": "orez-fiert",
  "category": "basics",
  "title": {
    "ro": "Orez Fiert Perfect",
    "en": "Perfect Boiled Rice"
  },
  "prepTime": 20,
  "servings": 4,
  "effortLevel": "easy",
  "image": "/images/recipes/orez-fiert.webp",
  "ingredients": [
    {
      "name": {
        "ro": "orez",
        "en": "rice"
      },
      "quantity": 200,
      "unit": {
        "ro": "g",
        "en": "g"
      }
    },
    {
      "name": {
        "ro": "apă",
        "en": "water"
      },
      "quantity": 400,
      "unit": {
        "ro": "ml",
        "en": "ml"
      }
    },
    {
      "name": {
        "ro": "sare",
        "en": "salt"
      },
      "quantity": 1,
      "unit": {
        "ro": "linguriță",
        "en": "tsp"
      }
    }
  ],
  "instructions": {
    "ro": [
      "Spălați orezul în apă rece până când apa devine clară.",
      "Puneți orezul într-o oală cu apă și sare.",
      "Aduceți la fierbere la foc mare.",
      "Reduceți focul la minim și acoperiți oala.",
      "Gătiți timp de 15-18 minute fără să ridicați capacul.",
      "Opriți focul și lăsați să stea acoperit 5 minute.",
      "Foițați orezul cu o furculiță și serviți."
    ],
    "en": [
      "Rinse rice in cold water until water runs clear.",
      "Place rice in a pot with water and salt.",
      "Bring to a boil over high heat.",
      "Reduce heat to low and cover the pot.",
      "Cook for 15-18 minutes without lifting the lid.",
      "Turn off heat and let stand covered for 5 minutes.",
      "Fluff rice with a fork and serve."
    ]
  },
  "personalNotes": {
    "ro": "Orezul fiert perfect este baza multor mâncăruri. Secretul este raportul corect de apă la orez (2:1) și să nu ridici capacul în timpul gătirii! Orezul absoarbe aburul și devine pufos. Dacă orezul tău iese lipicios, înseamnă că l-ai spălat prea puțin sau ai folosit prea multă apă. Practică face perfect!",
    "en": "Perfect boiled rice is the foundation of many dishes. The secret is the correct water-to-rice ratio (2:1) and not lifting the lid during cooking! The rice absorbs the steam and becomes fluffy. If your rice comes out sticky, it means you didn't rinse it enough or used too much water. Practice makes perfect!"
  },
  "keywords": ["vegetarian", "boiling"],
  "dateAdded": "2025-11-08"
}
