{
  "id": "tomato-marinara-pasta",
  "category": "pasta",
  "image": "images/pasta/tomato-marinara-pasta.jpg",
  "title": {
    "ro": "Paste cu Sos Marinara de Roșii Proaspete",
    "en": "Fresh Tomato Marinara Pasta"
  },
  "prepTime": 20,
  "servings": 3,
  "effortLevel": "easy",
  "ingredients": [
    {
      "name": {
        "ro": "paste la alegere",
        "en": "pasta of your choice"
      },
      "quantity": 300,
      "unit": {
        "ro": "g",
        "en": "g"
      },
      "ingredientId": 154
    },
    {
      "name": {
        "ro": "ceapă mare cubulețe",
        "en": "large onion diced"
      },
      "quantity": 1.5,
      "unit": {
        "ro": "buc",
        "en": "pcs"
      },
      "ingredientId": 108
    },
    {
      "name": {
        "ro": "usturoi feliat",
        "en": "garlic sliced"
      },
      "quantity": 5,
      "unit": {
        "ro": "căței",
        "en": "cloves"
      },
      "ingredientId": 104
    },
    {
      "name": {
        "ro": "ulei de măsline extravirgin",
        "en": "extra virgin olive oil"
      },
      "quantity": 3,
      "unit": {
        "ro": "linguri",
        "en": "Tbsp"
      },
      "ingredientId": 101
    },
    {
      "name": {
        "ro": "sare",
        "en": "salt"
      },
      "quantity": 1,
      "unit": {
        "ro": "praf",
        "en": "pinch"
      },
      "ingredientId": 100
    },
    {
      "name": {
        "ro": "roșii cherry sau sos de paste",
        "en": "cherry tomatoes or pasta sauce"
      },
      "quantity": 400,
      "unit": {
        "ro": "g",
        "en": "g"
      },
      "ingredientId": 125
    },
    {
      "name": {
        "ro": "parmezan ras",
        "en": "shredded parmesan cheese"
      },
      "quantity": 60,
      "unit": {
        "ro": "g",
        "en": "g"
      },
      "ingredientId": 146
    },
    {
      "name": {
        "ro": "pătrunjel tocat grosier",
        "en": "roughly chopped parsley"
      },
      "quantity": 0.25,
      "unit": {
        "ro": "cană",
        "en": "cup"
      },
      "ingredientId": 116
    },
    {
      "name": {
        "ro": "piper negru proaspăt măcinat",
        "en": "freshly ground black pepper"
      },
      "quantity": 0.25,
      "unit": {
        "ro": "linguriță",
        "en": "tsp"
      },
      "ingredientId": 102
    },
    {
      "name": {
        "ro": "piept de pui (opțional, pentru o versiune cu carne)",
        "en": "chicken breast (optional, for a non-vegetarian version)"
      },
      "quantity": 1,
      "unit": {
        "ro": "buc",
        "en": "pcs"
      },
      "ingredientId": 149
    }
  ],
  "instructions": {
    "ro": [
      "Adu o oală cu apă sărată la fierbere (5g sare per litru de apă) și de asemenea adu o tigaie largă la foc mediu.",
      "Dacă folosești puiul opțional: condimentează pieptul cu sare și piper și prăjește-l într-o tigaie separată, la foc mediu, 5-6 minute pe fiecare parte, până este bine gătit. Lasă-l deoparte și taie-l felii înainte de servire.",
      "Adaugă ulei în tigaia largă. Odată ce începe să sclipească, adaugă ceapa tocată și usturoiul.",
      "Când usturoiul și ceapa se înmoaie puțin, aproximativ 2-3 minute, adaugă roșiile cherry și acoperă cu capacul. Când apa fierbe adaugă pastele.",
      "Odată ce roșiile încep să se spargă, ia o spatulă și zdrobește roșiile pentru a elibera sucurile. Reduce focul la mic, presară puțină sare și lasă să se reducă.",
      "Scurge pastele și adaugă-le la sosul de roșii. Toarnă 1/4 cană de apă de paste și amestecă. Adaugă puiul feliat, dacă îl folosești.",
      "Lasă sosul să se reducă și adaugă parmezanul. Amestecă pătrunjelul împreună cu puțină apă și piperul negru proaspăt măcinat."
    ],
    "en": [
      "Bring a salted pot of water to a boil (5g salt per liter of water) as well as bring a wide saute pan to a medium heat.",
      "If using the optional chicken: season the breast with salt and pepper and fry it in a separate pan over medium heat for 5-6 minutes per side, until cooked through. Set aside and slice before serving.",
      "Add oil to the wide saute pan. Once it starts to shimmer, add in the chopped onion and garlic.",
      "When the garlic and onion soften a bit, approx 2-3 minutes, add in the cherry tomatoes and top it with the lid. When the water is boiling add in the pasta.",
      "Once the tomatoes are starting to burst, grab a spatula and mash the tomatoes to release the juices. Turn the heat to low, sprinkle in some more salt, and let reduce.",
      "Drain the pasta and add it to the tomato sauce. Pour in 1/4 cup of pasta water and toss. Add the sliced chicken, if using.",
      "Let the sauce reduce and add in the parmesan cheese. Toss in the parsley along with a little more water and the freshly ground black pepper."
    ]
  },
  "personalNotes": {
    "ro": "Rețetă de la: https://prohomecooks.com/blogs/recipes/4-easy-recipes-to-make-when-you-have-no-time",
    "en": "Recipe from: https://prohomecooks.com/blogs/recipes/4-easy-recipes-to-make-when-you-have-no-time"
  },
  "keywords": [
    "easy",
    "vegetarian",
    "boiling",
    "garlic",
    "onion",
    "tomatoes",
    "pasta",
    "parmesan"
  ],
  "dateAdded": "2025-11-17"
}
