{
  "id": "tuna-phili-spread",
  "category": "salads-and-bites",
  "image": "images/salads-and-bites/tuna-phili-spread.jpg",
  "title": {
    "ro": "Pastă de Ton cu Philadelphia",
    "en": "Tuna Phili Spread"
  },
  "prepTime": 10,
  "servings": 4,
  "effortLevel": "easy",
  "ingredients": [
    {
      "name": {
        "ro": "brânză philadelphia",
        "en": "philadelphia cheese"
      },
      "quantity": 300,
      "unit": {
        "ro": "g",
        "en": "g"
      },
      "ingredientId": 160
    },
    {
      "name": {
        "ro": "smântână",
        "en": "sour cream"
      },
      "quantity": 2,
      "unit": {
        "ro": "linguri",
        "en": "Tbsp"
      },
      "ingredientId": 112
    },
    {
      "name": {
        "ro": "conservă de ton bucăți",
        "en": "can of tuna chunks"
      },
      "quantity": 200,
      "unit": {
        "ro": "g",
        "en": "g"
      },
      "ingredientId": 161
    },
    {
      "name": {
        "ro": "suc de lămâie",
        "en": "lemon juice"
      },
      "quantity": 2,
      "unit": {
        "ro": "linguri",
        "en": "Tbsp"
      },
      "ingredientId": 158
    },
    {
      "name": {
        "ro": "pătrunjel tocat",
        "en": "chopped parsley"
      },
      "quantity": 2,
      "unit": {
        "ro": "linguri",
        "en": "Tbsp"
      },
      "ingredientId": 116
    },
    {
      "name": {
        "ro": "ceapă verde feliată subțire",
        "en": "green onions thinly sliced"
      },
      "quantity": 4,
      "unit": {
        "ro": "buc",
        "en": "pcs"
      },
      "ingredientId": 113
    },
    {
      "name": {
        "ro": "sare",
        "en": "salt"
      },
      "quantity": 1,
      "unit": {
        "ro": "după gust",
        "en": "to taste"
      },
      "ingredientId": 100
    }
  ],
  "instructions": {
    "ro": [
      "Scurge bucățile de ton înainte de a le adăuga.",
      "Adaugă toate ingredientele, excluzând ceapa verde, într-un blender și mixează totul.",
      "Garnisește cu ceapă verde. Adaugă mai multă sare dacă este necesar.",
      "Servește cu pâine."
    ],
    "en": [
      "Drain the tuna chunks before adding them.",
      "Add all the ingredients, excluding the green onion to a blender and mix everything.",
      "Garnish with green onions. Add more salt if needed.",
      "Serve with bread."
    ]
  },
  "personalNotes": {
    "ro": "Credit pentru această rețetă îi revine lui Rebeca, care a învățat rețeta de la un influencer de Instagram.",
    "en": "Credit for this recipe goes to Rebeca, who learned the recipe from an Instagram influencer."
  },
  "keywords": [
    "easy",
    "fish",
    "no-cook",
    "green-onion"
  ],
  "dateAdded": "2025-11-17"
}
