{
  "id": "burger-clasic",
  "category": "burgers-and-wraps",
  "image": "/images/recipes/burgers-and-wraps/burger-clasic.jpg",
  "title": {
    "ro": "Burger Clasic",
    "en": "Classic Burger"
  },
  "prepTime": 20,
  "servings": 4,
  "effortLevel": "easy",
  "image": "/images/recipes/burger-clasic.webp",
  "ingredients": [
    {
      "name": {
        "ro": "carne tocată de vită",
        "en": "ground beef"
      },
      "quantity": 600,
      "unit": {
        "ro": "g",
        "en": "g"
      }
    },
    {
      "name": {
        "ro": "chiflă pentru burger",
        "en": "burger buns"
      },
      "quantity": 4,
      "unit": {
        "ro": "buc",
        "en": "pcs"
      }
    },
    {
      "name": {
        "ro": "brânză cheddar",
        "en": "cheddar cheese"
      },
      "quantity": 4,
      "unit": {
        "ro": "felii",
        "en": "slices"
      }
    },
    {
      "name": {
        "ro": "roșii",
        "en": "tomatoes"
      },
      "quantity": 2,
      "unit": {
        "ro": "buc",
        "en": "pcs"
      }
    },
    {
      "name": {
        "ro": "salată iceberg",
        "en": "iceberg lettuce"
      },
      "quantity": 4,
      "unit": {
        "ro": "frunze",
        "en": "leaves"
      }
    },
    {
      "name": {
        "ro": "ceapă",
        "en": "onion"
      },
      "quantity": 1,
      "unit": {
        "ro": "buc",
        "en": "pcs"
      }
    },
    {
      "name": {
        "ro": "sare și piper",
        "en": "salt and pepper"
      },
      "quantity": 1,
      "unit": {
        "ro": "după gust",
        "en": "to taste"
      }
    }
  ],
  "instructions": {
    "ro": [
      "Formați 4 chiftele din carnea tocată, condimentate cu sare și piper.",
      "Încălziți grătarul sau tigaia la foc mare.",
      "Gătiți chiftelele 4-5 minute pe fiecare parte.",
      "În ultimul minut, adăugați brânza pe chiftele.",
      "Prăjiți ușor chiflele.",
      "Asamblați burgerul: chiflă, salată, chiftea cu brânză, roșii, ceapă.",
      "Serviți cu cartofi prăjiți."
    ],
    "en": [
      "Form 4 patties from ground beef, seasoned with salt and pepper.",
      "Heat grill or pan over high heat.",
      "Cook patties 4-5 minutes on each side.",
      "In the last minute, add cheese on patties.",
      "Lightly toast the buns.",
      "Assemble burger: bun, lettuce, patty with cheese, tomatoes, onion.",
      "Serve with french fries."
    ]
  },
  "personalNotes": {
    "ro": "Un burger bun începe cu carne de calitate. Îmi place să folosesc carne tocată cu 20% grăsime pentru a obține chiftele suculente. Nu apăsa chiftelele pe grătar - asta face carnea uscată! Lasă-le să se gătească liniștit. Poți personaliza burgerul cu sosurile tale preferate - eu recomand un mix de ketchup, muștar și maioneză.",
    "en": "A good burger starts with quality meat. I like to use ground beef with 20% fat to get juicy patties. Don't press the patties on the grill - that makes the meat dry! Let them cook peacefully. You can customize the burger with your favorite sauces - I recommend a mix of ketchup, mustard, and mayonnaise."
  },
  "keywords": ["beef", "tomatoes", "onions", "grilling"],
  "dateAdded": "2025-11-06"
}
