{
  "id": "one-pot-creamy-tomato-beef-pasta",
  "category": "pasta",
  "image": "images/pasta/one-pot-creamy-tomato-beef-pasta.jpg",
  "title": {
    "ro": "Paste Cremoase cu Vită și Roșii într-o Singură Oală",
    "en": "One Pot Creamy Tomato Beef Pasta"
  },
  "prepTime": 30,
  "servings": 4,
  "effortLevel": "easy",
  "ingredients": [
    {
      "name": {
        "ro": "ulei de măsline",
        "en": "olive oil"
      },
      "quantity": 1.5,
      "unit": {
        "ro": "linguri",
        "en": "Tbsp"
      },
      "ingredientId": 101
    },
    {
      "name": {
        "ro": "usturoi tocat fin",
        "en": "garlic, finely minced"
      },
      "quantity": 2,
      "unit": {
        "ro": "căței",
        "en": "cloves"
      },
      "ingredientId": 104
    },
    {
      "name": {
        "ro": "ceapă tocată fin",
        "en": "onion, finely chopped"
      },
      "quantity": 1,
      "unit": {
        "ro": "buc",
        "en": "pcs"
      },
      "ingredientId": 108
    },
    {
      "name": {
        "ro": "carne de vită tocată",
        "en": "ground beef"
      },
      "quantity": 400,
      "unit": {
        "ro": "g",
        "en": "g"
      },
      "ingredientId": 133
    },
    {
      "name": {
        "ro": "ierburi italienești (sau oregano uscat)",
        "en": "Italian herbs (or dried oregano)"
      },
      "quantity": 2,
      "unit": {
        "ro": "lingurițe",
        "en": "tsp"
      },
      "ingredientId": 103
    },
    {
      "name": {
        "ro": "pastă de roșii",
        "en": "tomato paste"
      },
      "quantity": 2,
      "unit": {
        "ro": "linguri",
        "en": "Tbsp"
      },
      "ingredientId": 207
    },
    {
      "name": {
        "ro": "roșii zdrobite la conservă (sau passata)",
        "en": "canned crushed tomatoes (or passata)"
      },
      "quantity": 400,
      "unit": {
        "ro": "g",
        "en": "g"
      },
      "ingredientId": 208
    },
    {
      "name": {
        "ro": "fulgi de chili (opțional)",
        "en": "chili flakes (optional)"
      },
      "quantity": 0.5,
      "unit": {
        "ro": "linguriță",
        "en": "tsp"
      },
      "ingredientId": 111
    },
    {
      "name": {
        "ro": "sare",
        "en": "salt"
      },
      "quantity": 1.5,
      "unit": {
        "ro": "lingurițe",
        "en": "tsp"
      },
      "ingredientId": 100
    },
    {
      "name": {
        "ro": "piper negru",
        "en": "black pepper"
      },
      "quantity": 0.5,
      "unit": {
        "ro": "linguriță",
        "en": "tsp"
      },
      "ingredientId": 102
    },
    {
      "name": {
        "ro": "supă de pui (cu puțină sare)",
        "en": "chicken stock (low sodium)"
      },
      "quantity": 800,
      "unit": {
        "ro": "ml",
        "en": "ml"
      },
      "ingredientId": 151
    },
    {
      "name": {
        "ro": "paste scurte (fusilli, penne, cornulețe)",
        "en": "short pasta (fusilli, penne, elbow macaroni)"
      },
      "quantity": 450,
      "unit": {
        "ro": "g",
        "en": "g"
      },
      "ingredientId": 154
    },
    {
      "name": {
        "ro": "smântână de gătit",
        "en": "cooking cream"
      },
      "quantity": 150,
      "unit": {
        "ro": "ml",
        "en": "ml"
      },
      "ingredientId": 144
    },
    {
      "name": {
        "ro": "parmezan ras fin, pentru servire",
        "en": "parmesan, finely grated, for serving"
      },
      "quantity": 40,
      "unit": {
        "ro": "g",
        "en": "g"
      },
      "ingredientId": 146
    },
    {
      "name": {
        "ro": "pătrunjel tocat (opțional)",
        "en": "parsley, chopped (optional)"
      },
      "quantity": 1,
      "unit": {
        "ro": "lingură",
        "en": "Tbsp"
      },
      "ingredientId": 116
    }
  ],
  "instructions": {
    "ro": [
      "Încălzește uleiul la foc mare într-o oală mare, cu fund gros. Adaugă usturoiul și ceapa și călește 1-2 minute, până se înmoaie.",
      "Adaugă carnea tocată și gătește, fărâmițând-o cu lingura, până nu se mai vede carne roșie.",
      "Adaugă ierburile italienești și gătește 30 de secunde, apoi adaugă pasta de roșii și mai gătește 1 minut, ca să dispară gustul crud.",
      "Adaugă roșiile, supa de pui, sarea, piperul și fulgii de chili, dacă folosești. Amestecă, apoi adaugă pastele.",
      "Adu la fiert, apoi fierbe la foc mediu 15 minute, până pastele sunt aproape gata. Amestecă la câteva minute, apoi mai des spre final, ca să nu se lipească de fund.",
      "Adaugă smântâna și mai fierbe 1-2 minute. Sosul trebuie să rămână destul de cremos, pentru că pastele absorb repede lichidul.",
      "Ia oala de pe foc, amestecă bine și servește în boluri, cu parmezan și pătrunjel."
    ],
    "en": [
      "Heat the oil on high in a large, heavy-based pot. Add garlic and onion and sauté for 1-2 minutes until softened.",
      "Add the ground beef and cook, breaking it up as you go, until you can no longer see red meat.",
      "Add the Italian herbs and cook for 30 seconds, then add the tomato paste and cook for 1 minute to remove the raw flavour.",
      "Add the crushed tomatoes, chicken stock, salt, pepper and chili flakes, if using. Stir, then add the pasta.",
      "Bring to a simmer and cook over medium heat for 15 minutes until the pasta is almost done. Stir every couple of minutes, then more often towards the end so it doesn't stick to the base.",
      "Stir in the cream and simmer for 1-2 minutes more. It should still be quite saucy, as the pasta absorbs liquid quickly.",
      "Remove from the heat, give it a good stir and ladle into bowls. Serve with parmesan and parsley."
    ]
  },
  "personalNotes": {
    "ro": "Rețetă de la: https://www.recipetineats.com/one-pot-creamy-tomato-beef-pasta/",
    "en": "Recipe from: https://www.recipetineats.com/one-pot-creamy-tomato-beef-pasta/"
  },
  "keywords": [
    "easy",
    "beef",
    "boiling",
    "garlic",
    "onion",
    "tomatoes",
    "pasta",
    "parmesan"
  ],
  "dateAdded": "2026-09-26"
}
