{
  "id": "chinese-stir-fried-noodles",
  "category": "stir-fries",
  "title": {
    "ro": "Tăiței Chinezești Prăjiți",
    "en": "Chinese Stir Fried Noodles"
  },
  "prepTime": 30,
  "servings": 3,
  "effortLevel": "medium",
  "image": "images/stir-fries/chinese-stir-fried-noodles.jpg",
  "ingredients": [
    {
      "section": {
        "ro": "Ingrediente de bază",
        "en": "Main ingredients"
      }
    },
    {
      "name": {
        "ro": "tăiței uscați (sau 300 g tăiței proaspeți), gătiți conform instrucțiunilor de pe pachet",
        "en": "dried noodles (or 300 g fresh noodles), prepared per packet instructions"
      },
      "quantity": 225,
      "unit": {
        "ro": "g",
        "en": "g"
      },
      "ingredientId": 172
    },
    {
      "name": {
        "ro": "ulei vegetal",
        "en": "vegetable oil"
      },
      "quantity": 3,
      "unit": {
        "ro": "linguri",
        "en": "Tbsp"
      },
      "ingredientId": 117
    },
    {
      "name": {
        "ro": "proteine la alegere (carne, pui, creveți sau tofu)",
        "en": "protein of choice (meat, chicken, shrimp or tofu)"
      },
      "quantity": 225,
      "unit": {
        "ro": "g",
        "en": "g"
      },
      "ingredientId": 226
    },
    {
      "name": {
        "ro": "legume tăiate (ceapă, morcovi, zucchini, varză, broccoli, bok choy, germeni de fasole)",
        "en": "chopped vegetables (onions, carrots, zucchini, cabbage, broccoli, bok choy, bean sprouts)"
      },
      "quantity": 600,
      "unit": {
        "ro": "g",
        "en": "g"
      },
      "ingredientId": 227
    },
    {
      "name": {
        "ro": "apă",
        "en": "water"
      },
      "quantity": 195,
      "unit": {
        "ro": "ml",
        "en": "ml"
      },
      "ingredientId": 106
    },
    {
      "section": {
        "ro": "Sos chinezesc pentru stir-fry (6 linguri, cât pentru această rețetă)",
        "en": "Chinese Stir Fry Sauce (6 Tbsp, enough for this recipe)"
      }
    },
    {
      "name": {
        "ro": "sos de soia",
        "en": "light soy sauce"
      },
      "quantity": 30,
      "unit": {
        "ro": "ml",
        "en": "ml"
      },
      "ingredientId": 107
    },
    {
      "name": {
        "ro": "sos de stridii",
        "en": "oyster sauce"
      },
      "quantity": 30,
      "unit": {
        "ro": "ml",
        "en": "ml"
      },
      "ingredientId": 183
    },
    {
      "name": {
        "ro": "vin chinezesc (sau sherry sec)",
        "en": "Chinese wine (or dry sherry)"
      },
      "quantity": 15,
      "unit": {
        "ro": "ml",
        "en": "ml"
      },
      "ingredientId": 119
    },
    {
      "name": {
        "ro": "amidon de porumb",
        "en": "cornstarch"
      },
      "quantity": 1,
      "unit": {
        "ro": "lingură",
        "en": "Tbsp"
      },
      "ingredientId": 120
    },
    {
      "name": {
        "ro": "zahăr",
        "en": "sugar"
      },
      "quantity": 0.75,
      "unit": {
        "ro": "linguriță",
        "en": "tsp"
      },
      "ingredientId": 115
    },
    {
      "name": {
        "ro": "ulei de susan prăjit",
        "en": "toasted sesame oil"
      },
      "quantity": 0.5,
      "unit": {
        "ro": "lingură",
        "en": "Tbsp"
      },
      "ingredientId": 118
    },
    {
      "name": {
        "ro": "piper alb",
        "en": "ground white pepper"
      },
      "quantity": 0.25,
      "unit": {
        "ro": "linguriță",
        "en": "tsp"
      },
      "ingredientId": 189
    },
    {
      "section": {
        "ro": "Arome de bază (opțional)",
        "en": "Base Flavourings (optional)"
      }
    },
    {
      "name": {
        "ro": "usturoi tocat fin",
        "en": "garlic, finely chopped"
      },
      "quantity": 2,
      "unit": {
        "ro": "căței",
        "en": "cloves"
      },
      "ingredientId": 104
    },
    {
      "name": {
        "ro": "ghimbir tocat fin",
        "en": "ginger, finely chopped"
      },
      "quantity": 1,
      "unit": {
        "ro": "linguriță",
        "en": "tsp"
      },
      "ingredientId": 164
    },
    {
      "name": {
        "ro": "ardei iute birds eye, tocat fin",
        "en": "birds eye chilli, finely chopped"
      },
      "quantity": 0.5,
      "unit": {
        "ro": "linguriță",
        "en": "tsp"
      },
      "ingredientId": 198
    }
  ],
  "instructions": {
    "ro": [
      "Pregătiți proteinele tăindu-le împotriva fibrelor în felii de 0,5 cm sau cuburi de 2 cm.",
      "Amestecați într-un bol mic toate ingredientele pentru sos, până se dizolvă amidonul. Ies aproximativ 6 linguri de sos, exact cât pentru această rețetă.",
      "Încălziți uleiul în wok la foc mare. Când uleiul este fierbinte, adăugați aromele de bază alese (usturoi, ghimbir, ardei iute) și prăjiți aproximativ 10 secunde - aveți grijă să nu se ardă!",
      "Adăugați ingredientele în ordinea timpului de gătit, începând cu cele care necesită cel mai mult timp, dar nu adăugați legumele cu frunze. Începeți cu ceapa și proteinele (împreună), urmate de broccoli și alte legume în formă de buchete, apoi morcovi, tulpini de legume cu frunze, zucchini și alte legume ferme, și în final varza și alte legume care necesită puțin timp de gătit. NU adăugați germeni de fasole sau legumele cu frunze - le veți adăuga la pasul următor.",
      "Scoateți de pe foc, adăugați legumele cu frunze (partea cu frunze a bok choy, spanac etc.) și germenii de fasole (dacă folosiți), tăițeii (folosiți degetele pentru a-i separa), tot sosul și apa.",
      "Returnați pe foc, amestecați ușor timp de 1 minut pentru a încălzi tăițeii și pentru ca sosul să se îngroașe. Dacă apa se evaporă prea repede, adăugați puțin mai multă.",
      "Serviți imediat."
    ],
    "en": [
      "Prepare the protein by slicing them against the grain into 1/4 inch (0.5 cm) slices or 3/4 inch (2 cm) cubes.",
      "Stir all the sauce ingredients together in a small bowl until the cornstarch dissolves. This makes about 6 Tbsp of sauce, exactly what this recipe needs.",
      "Heat oil in wok over high heat. When oil is hot, add Base Flavouring of choice (garlic, ginger, chilli) and stir fry for about 10 seconds - don't let them burn!",
      "Add ingredients in order of length of time to cook, starting with those that take the longest but do not add leafy greens. Start with onion and proteins (together), followed by broccoli and other vegetables in floret form, followed by carrots, stems of leafy greens, zucchini and other firm vegetables, and lastly cabbage and other vegetables that take little time to cook. DO NOT add bean sprouts or leafy greens - you will add them in the next step.",
      "Remove from heat, add leafy greens (leafy part of bok choy, spinach etc) and bean sprouts (if using), the noodles (use your fingers to break them up), all of the sauce and the water.",
      "Return to heat, gently toss for 1 minute to heat through the noodles and for the sauce to thicken. If the water evaporates too quickly, add a bit more.",
      "Serve immediately."
    ]
  },
  "personalNotes": {
    "ro": "Rețetă adaptată de la: https://www.recipetineats.com/chinese-stir-fried-noodles-build-your-own/#recipe. Aceasta este o rețetă versatilă care vă permite să folosiți orice legume și proteine aveți la îndemână. Formula lui Nagi este, pentru o porție: 1 1/2 căni tăiței + 1/2 cană proteine + 2-3 căni legume + 2 linguri sos + 1/4 cană apă. Cantitățile de sos de aici sunt un sfert din borcanul original \"all purpose\"; dacă vrei să ai sos la îndemână, înmulțește-le cu 4 și păstrează-l la frigider câteva săptămâni.",
    "en": "Recipe adapted from: https://www.recipetineats.com/chinese-stir-fried-noodles-build-your-own/#recipe. This is a versatile recipe that allows you to use whatever vegetables and proteins you have on hand. Nagi's formula, per serving, is: 1 1/2 cups noodles + 1/2 cup protein + 2-3 cups vegetables + 2 Tbsp sauce + 1/4 cup water. The sauce quantities here are a quarter of her original all-purpose jar; to keep sauce on hand, multiply them by 4 and store it in the fridge for a few weeks."
  },
  "keywords": [
    "medium",
    "pan-fry",
    "noodles",
    "broccoli",
    "garlic",
    "onion",
    "carrots",
    "pasta"
  ],
  "dateAdded": "2026-01-22"
}
